IDENTIFIER,IDENTIFFIER_TYPE,PUBLISHER,TITLE,PRIMARY_CREATORS,UNIVERSITY,SEMESTER,DEPARTMENT,COURSE CODE,NO. OF STUDENTS,PRESCRIBED/RECOMMENDED
978-0-071-28074-7,ISBN,McGraw-Hill,Human Development,"Diane E. Papalia, Sally Wendkos Olds, Ruth Duskin Feldman",UCT,1st & 2nd semester,Human Biology,HUB2017H,220,Prescribed
978-0-323-03663-4,ISBN,Elsevier / Mosby,Human Histology (3rd),"Alan Stevens, James Steven Lowe",UCT,1st & 2nd semester,Human Biology,HUB2017H,220,Prescribed
978-1-133-10893-1,ISBN,Cengage Learning,Human Physiology (8th),Lauralee Sherwood,UCT,1st & 2nd semester,Human Biology,HUB2017H,220,Prescribed
978-0-323-04331-1,ISBN,Elsevier / Mosby,Immunology for medical students (2nd),"Roderick Nairn, Matthew Helbert",UCT,1st & 2nd semester,Human Biology,HUB2017H,220,Recommended
978-0-815-34243-4,ISBN,Garland Sciences,Janeway’s Immunology (8th),Kenneth Murphy,UCT,1st & 2nd semester,Human Biology,HUB2017H,220,Recommended
978-0-340-94688-6,ISBN,CRC Press,Making sense of the ECG: a hands on guide,"Andrew Houghton, David Gray",UCT,1st & 2nd semester,Human Biology,HUB2017H,220,Recommended
978-0-729-54075-9,ISBN,Elsevier Australia,Mechanisms of Clinical Signs,"Mark Dennis, William Talbot Bowen, Lucy Cho",UCT,1st & 2nd semester,Human Biology,HUB2017H,220,Prescribed
978-0-323-05371-6,ISBN,Elsevier Health Sciences / Mosby,Medical Biochemistry (3rd),"John Baynes, Marek H. Dominiczak",UCT,1st & 2nd semester,Human Biology,HUB1007S,220,Prescribed
978-0-323-05371-6,ISBN,Elsevier Health Sciences / Mosby,Medical Biochemistry (3rd),"John Baynes, Marek H. Dominiczak",UCT,1st & 2nd semester,Human Biology,HUB2017H,220,Prescribed
978-0-702-05029-9,ISBN,Elsevier Health Sciences / Mosby,Medical Microbiology (5th),"Richard Georing, Hazel Dockell, Ivan Roitt, Mark Zuckerman, Derek Wakelin",UCT,1st & 2nd semester,Human Biology,HUB2017H,210,Prescribed
978-1-118-25741-8,ISBN,John Wiley & Sons,Medical Microbiology & Infection at a Glance (3rd),Stephen Gillespie & Kathleen Bamford,UCT,1st & 2nd semester,Human Biology,HUB2017H,220,Prescribed
978-1-118-30647-5,ISBN,John Wiley & Sons,Medical Pharmacology at a glance (6th),Michael J Neal,UCT,1st & 2nd semester,Human Biology,HUB2017H,220,Prescribed
978-8-481-74926-7,ISBN,Elsevier,Medical Physiology (12th),"Arthur C. Guyton, John Edward Hall",UCT,1st & 2nd semester,Human Biology,HUB2017H,220,Recommended
978-1-416-04702-5,ISBN,Elsevier / Saunders,Netter's Anatomy colouring book,John T. Hansen,UCT,1st semester,Human Biology,HUB1006F,220,Prescribed
978-0-702-03086-4,ISBN,Elsevier Health Sciences / Churchill Livingstone,Neuroanatomy: An illustrated colour text (4th),"Alan R. Crossman, David Neary",UCT,1st & 2nd semester,Human Biology,HUB2017H,210,Prescribed
978-0-071-60396-6,ISBN,McGraw-Hill,Neuroanatomy: Text and Atlas (4th),John Harry Martin,UCT,1st & 2nd semester,Human Biology,HUB2017H,220,Prescribed
978-0-198-56925-1,ISBN,Oxford University Press,Oxford Handbook of Infectious Diseases and Microbiology,"Estée Török, Fiona Cooke, Ed Moran",UCT,1st & 2nd semester,Human Biology,HUB2017H,220,Prescribed
978-0-620-39997-5,ISBN,"Health and Medical Publishing Group, UCT",South African Medicines Formulary (10th),"Rossiter and Blockman, UCT, Division of Clinical Pharmacology",UCT,1st & 2nd semester,Human Biology,HUB2017H,220,Prescribed
978-0-195-71926-0,ISBN,Oxford University Press,Textbook of Psychiatry for Southern Africa,"Brian Robertson, C. W. Allwood, C. A. Gagiano",UCT,1st & 2nd semester,Human Biology,HUB2017H,220,Prescribed
978-1-429-23205-0,ISBN,Worth Publishers,The Developing Person through the Lifespan (7th ),Kathleen Stassen Berger,UCT,1st semester,Human Biology,HUB1006F,220,Prescribed
978-0-443-07367-0,ISBN,Elsevier / Churchill Livingstone,Virology- An Illustrated Colour Text,"Korsman, van Zyl, Nutt, Anderson, Preiser",UCT,1st & 2nd semester,Human Biology,HUB2017H,220,Prescribed
978-0-443-06850-8,ISBN,Elsevier Health Sciences / Churchill Livingstone,Wheater's Functional Histology (5th),Barbara Young,UCT,1st & 2nd semester,Human Biology,HUB2017H,220,Prescribed
978-0538453028,ISBN,Cengage Learning,C# Programming: From Problem Analysis to Program Design Edition: 3rd,Barbara Doyle ,UCT,1st semester,Information Systems,INF1003F,16,Recommended
978-1408066362,ISBN,Cengage Learning,"Database Principles: Fundamentals Of Design, Implementations And Management",Stephen Morris,UCT,1st semester,Information Systems,INF2007F,33,Recommended
9780538469685,ISBN,Thomson Learning,"Database Systems: Design, Implementation, and Management","Peter Rob, Carlos Coronel and Keeley Crockett",UCT,1st semester,Information Systems,INF2007F,33,Recommended
978-1-118-49030-3,ISBN,John Wiley & Sons,Excel 2013 Bible,John Walkenbach,UCT,1st & 2nd semester,Information Systems,INF1002H,81,Prescribed
978-1-118-49030-3,ISBN,John Wiley & Sons,Excel 2013 Bible,John Walkenbach,UCT,1st semester,Information Systems,INF1102F,81,Prescribed
978-0-077-12536-3,ISBN,McGraw-Hill,Object-oriented Systems Analysis and Design Using UML (4th (or 3rd) Edition),"Simon Bennett, Ray Farmer, Steve McRobb",UCT,1st & 2nd semester,Information Systems,INF4015W,32,Prescribed
9780273716860,ISBN,Prentice Hall,Research methods for business students,"Sounders, Lewis, Thornhill",UCT,1st & 2nd semester,Information Systems,INF4024W,80,Prescribed
978-1-847-19677-4,ISBN,Packt Publishing Ltd,Scratch 1.4: Beginner's Guide [Paperback],Michael Badger ,UCT,1st & 2nd semester,Information Systems,INF1002H,81,Prescribed
978-1-847-19677-4,ISBN,Packt Publishing Ltd,Scratch 1.4: Beginner's Guide [Paperback],Michael Badger ,UCT,1st semester,Information Systems,INF1102F,81,Prescribed
978-1305075191,ISBN,Cengage Learning,Scratch 2.0,Jerry Lee Ford,UCT,2nd Semester,Information Systems,INF1102S,130,Recommended
9780230229549,ISBN,Palgrave MacMillan,People Management in Turbulent Times,Adrian Furnham,UCT,2nd Semester,Information Systems,INF2011S,60,Recommended
978-1-408-23374-0,ISBN,Longman,Alaysing sentences: An Introduction to English Syntax (3rd edition),N Burton-Roberts,UCT,1st & 2nd semester,Linguistics,AXL2301S,50,Recommended
978-1-408-23374-0,ISBN,Longman,Alaysing sentences: An Introduction to English Syntax (3rd edition),N Burton-Roberts,UCT,1st semester,Linguistics,AXL2300F,55,Recommended
978-1-133-31068-6,ISBN,Wadsworth,An Introduction To Language (8th),"V Fromkin, R Rodman & N Hyams",UCT,1st semester,Linguistics,AXL1300F,180,Prescribed
978-0-312-17571-9,ISBN,Longmans,Contact Languages: Pidgins & Creoles,M Sebba,UCT,1st semester,Linguistics,AXL5310F,5,Prescribed
978-0-748-63844-4,ISBN,Edinburgh University Press,Introducing Sociolinguistics (2nd),"R Mesthrie, J Swann, A Deumert, W Leap",UCT,2nd Semester,Linguistics,AXL1301S,145,Prescribed
978-0-521-79105-2,ISBN,Cambridge University Press,Language in South Africa (Local 'Africa Collection' Edition),R Mesthrie,UCT,1st semester,Linguistics,AXL2301S,50,Recommended
978-1-405-15246-4,ISBN,Basil Blackwell,Sociolinguistic Theory (3rd),JK Chambers,UCT,2nd Semester,Linguistics,AXL4306S,6,Prescribed
978-1-444-33429-6,ISBN,Wiley-Blackwell,Vowels and Consonants (3rd),"Peter Ladefoged, Sandra Ferrari Disner",UCT,1st semester,Linguistics,AXL2300F,55,Prescribed
978-0-521-79733-7,ISBN,Cambridge University Press,World Englishes: The Study of New Linguistic Varieties,R Mesthrie and RM Bhatt,UCT,1st semester,Linguistics,AXL5310F,5,Prescribed
978-0-195-98836-9,ISBN,Oxford University Press,An introduction to psychological assessment in the South African context (4th Ed.),"Foxcroft, C.& Roodt, G",UCT,1st & 2nd semester,Management Studies,BUS4006W,50,Prescribed
978-0-195-98836-9,ISBN,Oxford University Press,An introduction to psychological assessment in the South African context (4th Ed.),"Foxcroft, C.& Roodt, G",UCT,1st & 2nd semester,Management Studies,BUS5033W ,10,Prescribed
978-0-205-81031-4,ISBN,Pearson,Beginning behavioural research: A conceptual primer (7th),"Rosnow, R.L., & Rosenthal, R.",UCT,2nd semester,Management Studies,BUS3004S ,121,Prescribed
978-0-136-09019-9,ISBN,Prentice Hall,Behaviour in organisations (10th),Jerald Greenberg,UCT,2nd semester,Management Studies,BUS1007S ,250,Prescribed
978-0-136-09019-9,ISBN,Prentice Hall,Behaviour in organisations (10th),Jerald Greenberg,UCT,1st semester,Management Studies,BUS2018F,150,Prescribed
978-0-132-08996-8,ISBN,Pearson Prentice Hall,Business Market Management (3rd Edition),"James C. anderson, James A. Narus, Das Narayandas",UCT,2nd semester,Management Studies,BUS4058S,60,Prescribed
978-0072865783,ISBN,McGraw-Hill,Business Marketing (4th ),Dwyer F. R and Tanner J.F.,UCT,2nd semester,Management Studies,BUS4019S ,60,Prescribed
978-0-135-05309-6,ISBN,Prentice Hall,Consumer Behaviour (10th ed),"Leon G. Schiffman, Leslie Lazar Kanuk, Joseph Wisenblit",UCT,1st semester,Management Studies,BUS3041F,80,Prescribed
978-0-135-05309-6,ISBN,Prentice Hall,Consumer Behaviour (10th ed),"Leon G. Schiffman, Leslie Lazar Kanuk, Joseph Wisenblit",UCT,2nd semester,Management Studies,BUS4017S,72,Prescribed
978-1-446-24918-5,ISBN,Sage,Discovering Statistics using IBM SPSS Statistics,"Field, A",UCT,1st & 2nd semester,Management Studies,BUS4006W,50,Prescribed
978-0-132-71915-5,ISBN,Prentice Hall,Global Marketing (7th Edition),"Keegan, W.J. & Green, M.C.",UCT,1st & 2nd semester,Management Studies,BUS4026W,50,Prescribed
978-0-195-99118-5,ISBN,Oxford University Press,International Marketing ,Burgess & Bothma,UCT,2nd semester,Management Studies,BUS4019S ,73,Prescribed
978-0-702-17767-5,ISBN,Juta,Labour Relations in practice: An outcomes based approach,Sonia Bendix,UCT,1st semester,Management Studies,BUS2018F,150,Prescribed
978-0-195-78913-3,ISBN,Oxford University Press,Managing South African Tourism,"George, R",UCT,1st semester,Management Studies,BUS4080F ,23,Prescribed
978-0-199-04403-0,ISBN,Oxford University Press ,Managing Training and Development in South Africa (5th Ed. ),Piet Nel,UCT,1st semester,Management Studies,BUS3002F,120,Prescribed
978-1-770-25981-2,ISBN,Pearson,Marketing Research,"D. Petzer, A. Berndt",UCT,1st semester,Management Studies,BUS3014F,79,Prescribed
978-8-131-73181-9,ISBN,Pearson,Marketing Research: An Applied Orientation,Naresh K. Malhotra,UCT,1st & 2nd semester,Management Studies,BUS3008W,60,Prescribed
978-0-195-99540-4,ISBN,Oxford University Press,Marketing Tourism In South Africa (4th),"George, R",UCT,1st & 2nd semester,Management Studies,BUS3043S,65,Prescribed
978-0-195-99540-4,ISBN,Oxford University Press,Marketing Tourism In South Africa (4th),"George, R",UCT,1st & 2nd semester,Management Studies,BUS4018S,100,Prescribed
978-0-195-99540-4,ISBN,Oxford University Press,Marketing Tourism In South Africa (4th),"George, R",UCT,1st & 2nd semester,Management Studies,BUS4080F,23,Prescribed
978-1-444-32416-7,ISBN,Wiley-Blackwell,Occupational Health Psychology ,"Stavroula Leka, Jonathan Houdmont",UCT,1st semester,Management Studies,BUS3002F ,120,Prescribed
978-0-132-55638-5,ISBN,Pearson ,Performance management (3rd),Herman Aguinis,UCT,2nd semester,Management Studies,BUS2022S,150,Prescribed
978-1-770-25561-6,ISBN,Pearson ,Principles of Marketing: Global and South African Perspectives (12th edition),"Philip Kotler, Gary M. Armstrong, Madéle Tait",UCT,1st semester,Management Studies,BUS2010F,550,Prescribed
978-1-770-25561-6,ISBN,Pearson ,Principles of Marketing: Global and South African Perspectives (12th edition),"Philip Kotler, Gary M. Armstrong, Madéle Tait",UCT,1st semester,Management Studies,BUS2011F,150,Prescribed
978-1-118-02658-8,ISBN,Wiley,"Quantitative Risk Management, + Website: A Practical Guide to Financial Risk (1st)",Thomas S Coleman,UCT,2nd semester,Management Studies,BUS5044S ,11,Prescribed
978-0-070-26437-3,ISBN,McGraw-Hill,Retailing Management (8th ed),"Levy, M. & Weitz, B.",UCT,2nd semester,Management Studies,BUS4018S,103,Prescribed
978-0-070-26437-3,ISBN,McGraw-Hill,Retailing Management (8th ed),"Levy, M. & Weitz, B.",UCT,1st & 2nd semester,Management Studies,BUS4026W,50,Prescribed
978-0-132-76359-2,ISBN,Pearson,Strategic staffing (2nd international ed.),"Phillips, J.S. & Gully, J.M.",UCT,2nd semester,Management Studies,BUS2022S,150,Prescribed
978-1-844-80000-1,ISBN,Cengage Learning,Stretegic Marketing Management (Latest edition),Luiz Moutinho & Geoff Southern,UCT,1st & 2nd semester,Management Studies,BUS4026W,60,Prescribed
9780521277037,ISBN,Cambridge University Press,A First Course in General Relativity,BF Schutz,UCT,1st & 2nd semester,Mathematics and Applied Mathematics,MAM3040W,,Recommended
9780521277037,ISBN,Cambridge University Press,A First Course in General Relativity,BF Schutz,UCT,1st & 2nd semester,Mathematics and Applied Mathematics,MAM3041H,,Recommended
9780521277037,ISBN,Cambridge University Press,A First Course in General Relativity,BF Schutz,UCT,1st & 2nd semester,Mathematics and Applied Mathematics,MAM3048H,,Recommended
978-0-07-110672-3,ISBN,McGraw-Hill International,"Applied Calculus for Business, Economics, and the Social and Life Sciences (9 or10  Edition, Expanded Edition)",Hoffmann and Bradley,UCT,1st semester,Mathematics and Applied Mathematics,MAM1004F,190,Prescribed
978-0-07-110672-3,ISBN,McGraw-Hill International,"Applied Calculus for Business, Economics, and the Social and Life Sciences (9 or10  Edition, Expanded Edition)",Hoffmann and Bradley,UCT,2nd semester,Mathematics and Applied Mathematics,MAM1004S,,Prescribed
0-534-37718-1,ISBN,Thomson Learning,Calculus: Concepts and Contexts,James Stewart,UCT,1st & 2nd semester,Mathematics and Applied Mathematics,MAM1006H,150,Prescribed
0-534-37718-1,ISBN,Thomson Learning,Calculus: Concepts and Contexts,James Stewart,UCT,1st & 2nd semester,Mathematics and Applied Mathematics,MAM2000W,,Prescribed
0-534-37718-1,ISBN,Thomson Learning,Calculus: Concepts and Contexts,James Stewart,UCT,1st & 2nd semester,Mathematics and Applied Mathematics,MAM2001H,,Prescribed
0-534-37718-1,ISBN,Thomson Learning,Calculus: Concepts and Contexts,James Stewart,UCT,2nd semester,Mathematics and Applied Mathematics,MAM2002S,,Prescribed
0-534-37718-1,ISBN,Thomson Learning,Calculus: Concepts and Contexts,James Stewart,UCT,1st & 2nd semester,Mathematics and Applied Mathematics,MAM2003Z,,Prescribed
0-534-37718-1,ISBN,Thomson Learning,Calculus: Concepts and Contexts,James Stewart,UCT,1st semester,Mathematics and Applied Mathematics,MAM2083F,600,Prescribed
0-534-37718-1,ISBN,Thomson Learning,Calculus: Concepts and Contexts,James Stewart,UCT,1st & 2nd semester,Mathematics and Applied Mathematics,MAM2AC ,260,Prescribed
0-534-40983-0,ISBN,Thomson Learning,Calculus: Concepts and Contexts (Metric Version) 4th edition,James Stewart,UCT,1st & 2nd semester,Mathematics and Applied Mathematics,MAM1000W,500,Prescribed
0-534-40983-0,ISBN,Thomson Learning,Calculus: Concepts and Contexts (Metric Version) 4th edition,James Stewart,UCT,1st semester,Mathematics and Applied Mathematics,MAM1020F,300,Prescribed
0-534-40983-0,ISBN,Thomson Learning,Calculus: Concepts and Contexts (Metric Version) 4th edition,James Stewart,UCT,2nd semester,Mathematics and Applied Mathematics,MAM1020S,300,Prescribed
0-534-40983-0,ISBN,Thomson Learning,Calculus: Concepts and Contexts (Metric Version) 4th edition,James Stewart,UCT,1st semester,Mathematics and Applied Mathematics,MAM1021F,100,Prescribed
0-534-40983-0,ISBN,Thomson Learning,Calculus: Concepts and Contexts Metric Version (4th Edition),James Stewart,UCT,1st & 2nd semester,Mathematics and Applied Mathematics,MAM1005H,250,Recommended
0-201530821,ISBN,Addison Wesley,Computational Complexity,Christos H. Papadimitriou,UCT,1st & 2nd semester,Mathematics and Applied Mathematics,MAM4007W,35,Recommended
978-0521424264 ,ISBN,Cambridge University Press,Computational Complexity: A Modern Approach,"Sanjeev Arora, Boaz Barak",UCT,1st & 2nd semester,Mathematics and Applied Mathematics,MAM4007W,35,Recommended
?,ISBN,?,Computer Programming in MATLAB,T Chinyoka,UCT,1st semester,Mathematics and Applied Mathematics,MAM2082F,300,Prescribed
978-0-495-55623-7,ISBN,Thomson Learning,Differential Equations With Boundary Value Problems (7th edition),D G Zill and M R Cullen ,UCT,1st & 2nd semester,Mathematics and Applied Mathematics,MAM2046W,,Prescribed
978-0-495-55623-7,ISBN,Thomson Learning,Differential Equations With Boundary Value Problems (7th edition),D G Zill and M R Cullen ,UCT,1st & 2nd semester,Mathematics and Applied Mathematics,MAM2047H,,Prescribed
978-0-495-55623-7,ISBN,Thomson Learning,Differential Equations With Boundary Value Problems (7th edition),D G Zill and M R Cullen ,UCT,1st & 2nd semester,Mathematics and Applied Mathematics,MAM2048H,,Prescribed
978-0-495-55623-7,ISBN,Thomson Learning,Differential Equations With Boundary Value Problems (7th edition),D G Zill and M R Cullen ,UCT,1st & 2nd semester,Mathematics and Applied Mathematics,MAM2OD,40,Prescribed
0-13-26-3807-X ,ISBN,Prentice Hall,Elementary Applied Partial Differential Equations with Boundary Value Problems (3rd or any other edition),R. Habermann,UCT,1st & 2nd semester,Mathematics and Applied Mathematics,MAM2046W,,Recommended
0-13-26-3807-X ,ISBN,Prentice Hall,Elementary Applied Partial Differential Equations with Boundary Value Problems (3rd or any other edition),R. Habermann,UCT,1st & 2nd semester,Mathematics and Applied Mathematics,MAM2047H,,Recommended
0-13-26-3807-X ,ISBN,Prentice Hall,Elementary Applied Partial Differential Equations with Boundary Value Problems (3rd or any other edition),R. Habermann,UCT,1st & 2nd semester,Mathematics and Applied Mathematics,MAM2048H,,Recommended
0-471-50998-1,ISBN,Dennis Publisher,Elementary Differential Equations and Boundary Value Problems,William E. Boyce and Richard C. DiPrima,UCT,1st & 2nd semester,Mathematics and Applied Mathematics,MAM2000W,,Recommended
0-471-50998-1,ISBN,Dennis Publisher,Elementary Differential Equations and Boundary Value Problems,William E. Boyce and Richard C. DiPrima,UCT,1st & 2nd semester,Mathematics and Applied Mathematics,MAM2001H,,Recommended
0-471-50998-1,ISBN,Dennis Publisher,Elementary Differential Equations and Boundary Value Problems,William E. Boyce and Richard C. DiPrima,UCT,1st & 2nd semester,Mathematics and Applied Mathematics,MAM2002S,,Recommended
0-471-50998-1,ISBN,Dennis Publisher,Elementary Differential Equations and Boundary Value Problems,William E. Boyce and Richard C. DiPrima,UCT,1st & 2nd semester,Mathematics and Applied Mathematics,MAM2003Z,,Recommended
0-471-50998-1,ISBN,Dennis Publisher,Elementary Differential Equations and Boundary Value Problems,William E. Boyce and Richard C. DiPrima,UCT,1st & 2nd semester,Mathematics and Applied Mathematics,MAM2004H,,Recommended
?,ISBN,?,Engineering Statics  ,C Hellaby,UCT,2nd semester,Mathematics and Applied Mathematics,MAM1042S,360,Prescribed
1 8689 11438,ISBN,Prentice Hall SA,Essential MATLAB for Scientists & Engineers (3rd edition),B D Hahn,UCT,1st & 2nd semester,Mathematics and Applied Mathematics,MAM1043H,180,Recommended
1 8689 11438,ISBN,Prentice Hall SA,Essential MATLAB for Scientists & Engineers (3rd edition),B D Hahn,UCT,1st & 2nd semester,Mathematics and Applied Mathematics,MAM1044H,180,Recommended
1 8689 11438,ISBN,Prentice Hall SA,Essential MATLAB for Scientists & Engineers (3rd edition),B D Hahn,UCT,1st & 2nd semester,Mathematics and Applied Mathematics,MAM2082F,300,Recommended
0-534-41967-4,ISBN,Thomson Learning,Finite Mathematics and Applied Calculus (4th or 5th edition),Stefan Waner & Steven R Costenoble,UCT,1st semester,Mathematics and Applied Mathematics,MAM1010F,841,Prescribed
0-534-41967-4,ISBN,Thomson Learning,Finite Mathematics and Applied Calculus (4th or 5th edition),Stefan Waner & Steven R Costenoble,UCT,2nd semester,Mathematics and Applied Mathematics,MAM1010S,170,Prescribed
0-534-41967-4,ISBN,Thomson Learning,Finite Mathematics and Applied Calculus (4th or 5th edition),Stefan Waner & Steven R Costenoble,UCT,2nd semester,Mathematics and Applied Mathematics,MAM1012F,209,Prescribed
0-534-41967-4,ISBN,Thomson Learning,Finite Mathematics and Applied Calculus (4th or 5th edition),Stefan Waner & Steven R Costenoble,UCT,2nd semester,Mathematics and Applied Mathematics,MAM1012S,530,Prescribed
0-387-97245-5,ISBN,Springer-Verlag,For Functional Analysis 1 and II: A first course in Functional Analysis (Second edition),John B Conway,UCT,1st & 2nd semester,Mathematics and Applied Mathematics,MAM4000W,15,Recommended
387903283,ISBN,Springer-Verlag,Functions of One Complex Variable I (Graduate Texts In Mathematics11) (2nd edition),John B. Conway,UCT,1st & 2nd semester,Mathematics and Applied Mathematics,MAM3 CA,40,Prescribed
387903283,ISBN,Springer-Verlag,Functions of One Complex Variable I (Graduate Texts In Mathematics11) (2nd edition),John B. Conway,UCT,1st & 2nd semester,Mathematics and Applied Mathematics,MAM3000W,48,Prescribed
387903283,ISBN,Springer-Verlag,Functions of One Complex Variable I (Graduate Texts In Mathematics11) (2nd edition),John B. Conway,UCT,1st & 2nd semester,Mathematics and Applied Mathematics,MAM3001W,0,Prescribed
387903283,ISBN,Springer-Verlag,Functions of One Complex Variable I (Graduate Texts In Mathematics11) (2nd edition),John B. Conway,UCT,1st & 2nd semester,Mathematics and Applied Mathematics,MAM3002H,15,Prescribed
387903283,ISBN,Springer-Verlag,Functions of One Complex Variable I (Graduate Texts In Mathematics11) (2nd edition),John B. Conway,UCT,1st & 2nd semester,Mathematics and Applied Mathematics,MAM3003S,2,Prescribed
387903283,ISBN,Springer-Verlag,Functions of One Complex Variable I (Graduate Texts In Mathematics11) (2nd edition),John B. Conway,UCT,1st & 2nd semester,Mathematics and Applied Mathematics,MAM3004Z,,Prescribed
0 5217 8451 4,ISBN,Cambridge University Press,Introduction to Lattices and Order (2nd edition),BA Davey & HA Priestley,UCT,1st & 2nd semester,Mathematics and Applied Mathematics,MAM3000W,48,Prescribed
0 5217 8451 4,ISBN,Cambridge University Press,Introduction to Lattices and Order (2nd edition),BA Davey & HA Priestley,UCT,1st & 2nd semester,Mathematics and Applied Mathematics,MAM3001W,0,Prescribed
0 5217 8451 4,ISBN,Cambridge University Press,Introduction to Lattices and Order (2nd edition),BA Davey & HA Priestley,UCT,1st & 2nd semester,Mathematics and Applied Mathematics,MAM3002H,15,Prescribed
0 5217 8451 4,ISBN,Cambridge University Press,Introduction to Lattices and Order (2nd edition),BA Davey & HA Priestley,UCT,1st & 2nd semester,Mathematics and Applied Mathematics,MAM3003S,2,Prescribed
0 5217 8451 4,ISBN,Cambridge University Press,Introduction to Lattices and Order (2nd edition),BA Davey & HA Priestley,UCT,1st & 2nd semester,Mathematics and Applied Mathematics,MAM3004Z,,Prescribed
0-13-537102-3,ISBN,Prentice Hall,Linear Algebra,"Stephen H. Friedberg, Arnold J. Insel and Lawrence E. Spence",UCT,1st & 2nd semester,Mathematics and Applied Mathematics,MAM2000W,,Recommended
0-13-537102-3,ISBN,Prentice Hall,Linear Algebra,"Stephen H. Friedberg, Arnold J. Insel and Lawrence E. Spence",UCT,1st & 2nd semester,Mathematics and Applied Mathematics,MAM2001H,,Recommended
0-13-537102-3,ISBN,Prentice Hall,Linear Algebra,"Stephen H. Friedberg, Arnold J. Insel and Lawrence E. Spence",UCT,2nd semester,Mathematics and Applied Mathematics,MAM2002S,,Recommended
0-13-537102-3,ISBN,Prentice Hall,Linear Algebra,"Stephen H. Friedberg, Arnold J. Insel and Lawrence E. Spence",UCT,1st & 2nd semester,Mathematics and Applied Mathematics,MAM2003Z,,Recommended
0-13-537102-3,ISBN,Prentice Hall,Linear Algebra,"Stephen H. Friedberg, Arnold J. Insel and Lawrence E. Spence",UCT,1st & 2nd semester,Mathematics and Applied Mathematics,MAM2004H,,Recommended
978-0817647629,ISBN,Birkhäuser,Logic for Computer Scientists,U Schöning,UCT,1st & 2nd semester,Mathematics and Applied Mathematics,MAM3000W,48,Recommended
978-0817647629,ISBN,Birkhäuser,Logic for Computer Scientists,U Schöning,UCT,1st & 2nd semester,Mathematics and Applied Mathematics,MAM3001W,0,Recommended
978-0817647629,ISBN,Birkhäuser,Logic for Computer Scientists,U Schöning,UCT,1st & 2nd semester,Mathematics and Applied Mathematics,MAM3002H,15,Recommended
978-0817647629,ISBN,Birkhäuser,Logic for Computer Scientists,U Schöning,UCT,1st & 2nd semester,Mathematics and Applied Mathematics,MAM3003S,2,Recommended
978-0817647629,ISBN,Birkhäuser,Logic for Computer Scientists,U Schöning,UCT,1st & 2nd semester,Mathematics and Applied Mathematics,MAM3004Z,,Recommended
?,ISBN,?,Methods of functions of Complex Variables ,,UCT,1st & 2nd semester,Mathematics and Applied Mathematics,MAM3040W,,Recommended
?,ISBN,?,Methods of functions of Complex Variables ,,UCT,1st & 2nd semester,Mathematics and Applied Mathematics,MAM3041H,,Recommended
?,ISBN,?,Methods of functions of Complex Variables ,,UCT,1st & 2nd semester,Mathematics and Applied Mathematics,MAM3043S,,Recommended
?,ISBN,?,Methods of functions of Complex Variables ,,UCT,1st & 2nd semester,Mathematics and Applied Mathematics,MAM3044F,,Recommended
?,ISBN,?,Methods of functions of Complex Variables ,,UCT,1st & 2nd semester,Mathematics and Applied Mathematics,MAM3045S,,Recommended
?,ISBN,?,Methods of functions of Complex Variables ,,UCT,1st & 2nd semester,Mathematics and Applied Mathematics,MAM3048H,,Recommended
534392016,ISBN,Thomson Learning,Numerical Analysis (7th or 8th edition),Burden and Faires,UCT,1st & 2nd semester,Mathematics and Applied Mathematics,MAM2046W,,Recommended
534392016,ISBN,Thomson Learning,Numerical Analysis (7th or 8th edition),Burden and Faires,UCT,1st & 2nd semester,Mathematics and Applied Mathematics,MAM2047H,,Recommended
534392016,ISBN,Thomson Learning,Numerical Analysis (7th or 8th edition),Burden and Faires,UCT,1st & 2nd semester,Mathematics and Applied Mathematics,MAM2048H,,Recommended
534392016,ISBN,Thomson Learning,Numerical Analysis (7th or 8th edition),Burden and Faires,UCT,1st & 2nd semester,Mathematics and Applied Mathematics,MAM3080F,130,Prescribed
978-0122191220,ISBN,Academic Press ,Solitons and Nonlinear Wave Equations,"J Gibbon, R Dodd, C Eilbeck & H Morris",UCT,1st & 2nd semester,Mathematics and Applied Mathematics,MAM3040W,,Recommended
